{
  "schemaVersion": "1.0",
  "runId": "review-<task>-<date>",
  "reviewId": "review-<task>",
  "baseCommit": "<base-commit>",
  "headCommit": "<head-commit>",
  "criteria": [
    {
      "id": "CRIT-001",
      "description": "The implementation satisfies the accepted requirement.",
      "verify": ["npm test"],
      "paths": ["src/**"]
    }
  ],
  "symbols": []
}
